file_path,product_name,category,pricing_usd,revenue_potential,marketplace_readiness,description
"/Users/steven/scripts/ai-workflow-manager.md","AI Workflow Manager","AI/ML Tools","TBD","$50K+","Ready","Multi-AI orchestration expert that routes tasks between Claude, Qwen, aider-env, and Ollama for maximum efficiency"
"/Users/steven/scripts/revenue-optimizer.md","Revenue Optimization Specialist","Business Automation","TBD","$950K+","Ready","Revenue generation and product launch expert for monetization strategies, Gumroad launches, pricing optimization"
"/Users/steven/AVATARARTS_PRODUCTS_AND_SERVICES.md","AI Enhancement Superbundle","AI/ML Tools","$199-299","$150K","Ready","Complete suite of 30+ security-enhanced userscripts for all major AI platforms"
"/Users/steven/AVATARARTS_PRODUCTS_AND_SERVICES.md","MCP Protocol Integration Suite","AI/ML Tools","$299-499","$499-999","Ready","Advanced Model Context Protocol implementations for Claude Desktop"
"/Users/steven/AVATARARTS_PRODUCTS_AND_SERVICES.md","Business Automation Superbundle","Business Automation","$299-799","$125K","Ready","Complete automation suite with 758+ Python scripts across 7 business verticals"
"/Users/steven/AVATARARTS_PRODUCTS_AND_SERVICES.md","Developer Content Creation Suite","Content Creation","$99-199","$35K","Ready","Tools for creating developer-focused content with professional quality"
"/Users/steven/AVATARARTS_PRODUCTS_AND_SERVICES.md","Advanced SEO Optimization Packages","SEO Tools","$199-399","$45K","Ready","Complete SEO optimization tools with AEO implementation"
"/Users/steven/AVATARARTS_PRODUCTS_AND_SERVICES.md","Intelligent Knowledge Management System","Knowledge Management","$199-499","$40K-150K","Ready","Advanced knowledge management with content-aware intelligence"
"/Users/steven/AVATARARTS_PRODUCTS_AND_SERVICES.md","Complete AI Productivity Superbundle","AI/ML Tools","$499","$500K+","Ready","All AI Enhancement Tools + AI Service Integrations + MCP Protocol Suite"
"/Users/steven/AVATARARTS_PRODUCTS_AND_SERVICES.md","Business Automation Pro Package","Business Automation","$599","$210K+","Ready","Business Automation Suite + Knowledge Management System + SEO Optimization"
"/Users/steven/AVATARARTS_PRODUCTS_AND_SERVICES.md","Enterprise AI Stack","AI/ML Tools","$999 + $199/mo","$300K+","Ready","All AI-related products with premium support"
"/Users/steven/scripts/recursive_content_aware_rename.sh","Recursive Content Aware Rename","File Management","TBD","TBD","Ready","Intelligent file renaming based on content rather than just filenames"
"/Users/steven/scripts/content_aware_rename.sh","Content Aware Rename","File Management","TBD","TBD","Ready","Content-aware file management tool with semantic understanding"
"/Users/steven/scripts/comprehensive_content_aware_rename.sh","Comprehensive Content Aware Rename","File Management","TBD","TBD","Ready","Advanced content-aware file management with multiple rename strategies"
"/Users/steven/scripts/complete_content_aware_rename.sh","Complete Content Aware Rename","File Management","TBD","TBD","Ready","Complete content-aware rename solution with multiple options"
"/Users/steven/scripts/execute_all_content_aware_rename.sh","Execute All Content Aware Rename","File Management","TBD","TBD","Ready","Batch execution of content-aware rename operations"
"/Users/steven/scripts/advanced-system-maintenance-v5.sh","Advanced System Maintenance","System Tools","TBD","TBD","Ready","Comprehensive system maintenance and optimization tools"
"/Users/steven/scripts/ai_tools_menu_simple.sh","AI Tools Menu","AI/ML Tools","TBD","TBD","Ready","Unified interface for accessing multiple AI platforms"
"/Users/steven/scripts/ai_unified_menu.sh","AI Unified Menu","AI/ML Tools","TBD","TBD","Ready","Comprehensive menu for all AI tools and integrations"
"/Users/steven/scripts/seo_optimization_automation.sh","SEO Optimization Automation","SEO Tools","TBD","TBD","Ready","Automated SEO optimization with AEO implementation"
"/Users/steven/scripts/organize_documents.sh","Document Organization Suite","File Management","TBD","TBD","Ready","Advanced document organization with content-aware intelligence"
"/Users/steven/scripts/masterxeo-advanced-manager.sh","MasterXEO Advanced Manager","Business Automation","TBD","TBD","Ready","Advanced business automation and management tools"
"/Users/steven/scripts/masterxeo-orchestrator.sh","MasterXEO Orchestrator","Business Automation","TBD","TBD","Ready","Business automation orchestration tools"
"/Users/steven/scripts/steven_website_generator.sh","Steven Website Generator","Web Development","TBD","TBD","Ready","Website generation tools with automation"
"/Users/steven/scripts/grok_integration.sh","Grok Integration Suite","AI/ML Tools","TBD","TBD","Ready","Advanced Grok AI integration tools"
"/Users/steven/scripts/ollama_menu.sh","Ollama Menu","AI/ML Tools","TBD","TBD","Ready","Menu system for Ollama AI models"
"/Users/steven/scripts/carbon_image_analyze_optimize.sh","Carbon Image Analyzer","Content Creation","TBD","TBD","Ready","Advanced Carbon image generation and analysis tools"
"/Users/steven/scripts/analysis_launcher.sh","Analysis Launcher","Analytics","TBD","TBD","Ready","Comprehensive analysis tool launcher"
"/Users/steven/scripts/ai-resource-manager.sh","AI Resource Manager","AI/ML Tools","TBD","TBD","Ready","AI resource management and optimization"
"/Users/steven/scripts/ai-watchdog.sh","AI Watchdog","AI/ML Tools","TBD","TBD","Ready","AI monitoring and management tools"
"/Users/steven/scripts/ai-cli-diagnostics.sh","AI CLI Diagnostics","AI/ML Tools","TBD","TBD","Ready","Diagnostic tools for AI command-line interfaces"
"/Users/steven/scripts/execute_all_content_aware_rename_fixed.sh","Execute All Content Aware Rename Fixed","File Management","TBD","TBD","Ready","Fixed version of content-aware rename batch executor"
"/Users/steven/scripts/complete_content_aware_rename_fixed.sh","Complete Content Aware Rename Fixed","File Management","TBD","TBD","Ready","Fixed version of complete content-aware rename"
"/Users/steven/scripts/execute_all_content_aware_rename_fixed.sh","Execute All Content Aware Rename Fixed","File Management","TBD","TBD","Ready","Fixed version of content-aware rename batch executor"
"/Users/steven/scripts/enhanced_disk_cleanup.sh","Enhanced Disk Cleanup","System Tools","TBD","TBD","Ready","Advanced disk cleanup and optimization tools"
"/Users/steven/scripts/cleanup_system.sh","System Cleanup Suite","System Tools","TBD","TBD","Ready","Comprehensive system cleanup tools"
"/Users/steven/scripts/cleanup_python_conservative.sh","Python Cleanup Conservative","System Tools","TBD","TBD","Ready","Conservative Python cleanup tools"
"/Users/steven/scripts/python-env-cleanup.sh","Python Environment Cleanup","System Tools","TBD","TBD","Ready","Python environment cleanup and optimization"
"/Users/steven/scripts/cleanup_conda_envs.sh","Conda Environment Cleanup","System Tools","TBD","TBD","Ready","Conda environment management and cleanup"
"/Users/steven/scripts/migrate_to_mamba.sh","Mamba Migration Tools","System Tools","TBD","TBD","Ready","Migration tools for Mamba package manager"
"/Users/steven/scripts/setup_mcp_servers.sh","MCP Server Setup","AI/ML Tools","TBD","TBD","Ready","Setup tools for MCP protocol servers"
"/Users/steven/scripts/grok_menu.sh","Grok Menu System","AI/ML Tools","TBD","TBD","Ready","Menu system for Grok AI integration"
"/Users/steven/scripts/grok_integration.sh","Grok Integration Tools","AI/ML Tools","TBD","TBD","Ready","Advanced Grok AI integration capabilities"
"/Users/steven/scripts/grok-diagnostics.sh","Grok Diagnostics","AI/ML Tools","TBD","TBD","Ready","Diagnostic tools for Grok AI integration"
"/Users/steven/scripts/ai_tools_menu_simple.sh","Simple AI Tools Menu","AI/ML Tools","TBD","TBD","Ready","Simplified menu for AI tools access"
"/Users/steven/scripts/ai_unified_menu.sh","Unified AI Tools Menu","AI/ML Tools","TBD","TBD","Ready","Comprehensive unified menu for all AI tools"
"/Users/steven/scripts/ai-cli-diagnostics.sh","AI CLI Diagnostics","AI/ML Tools","TBD","TBD","Ready","Diagnostic tools for AI command-line interfaces"
"/Users/steven/scripts/ai-resource-manager.sh","AI Resource Manager","AI/ML Tools","TBD","TBD","Ready","Resource management for AI tools"
"/Users/steven/scripts/ai-watchdog.sh","AI Watchdog","AI/ML Tools","TBD","TBD","Ready","Monitoring tools for AI operations"
"/Users/steven/scripts/analysis_launcher.sh","Analysis Launcher","Analytics","TBD","TBD","Ready","Launcher for analysis tools"
"/Users/steven/scripts/carbon_image_analyze_optimize.sh","Carbon Image Analyzer","Content Creation","TBD","TBD","Ready","Analysis and optimization for Carbon images"
"/Users/steven/scripts/cleanup_system.sh","System Cleanup Suite","System Tools","TBD","TBD","Ready","Comprehensive system cleanup tools"
"/Users/steven/scripts/enhanced_disk_cleanup.sh","Enhanced Disk Cleanup","System Tools","TBD","TBD","Ready","Advanced disk cleanup capabilities"
"/Users/steven/scripts/masterxeo-advanced-manager.sh","MasterXEO Advanced Manager","Business Automation","TBD","TBD","Ready","Advanced business automation tools"
"/Users/steven/scripts/masterxeo-orchestrator.sh","MasterXEO Orchestrator","Business Automation","TBD","TBD","Ready","Business automation orchestration"
"/Users/steven/scripts/organize_documents.sh","Document Organization Suite","File Management","TBD","TBD","Ready","Advanced document organization tools"
"/Users/steven/scripts/seo_optimization_automation.sh","SEO Optimization Automation","SEO Tools","TBD","TBD","Ready","Automated SEO optimization tools"
"/Users/steven/scripts/steven_website_generator.sh","Steven Website Generator","Web Development","TBD","TBD","Ready","Website generation automation"
"/Users/steven/scripts/upwork_job_scraper_multi_feed.py","Upwork Job Scraper","Freelance Tools","TBD","TBD","Ready","Multi-feed Upwork job scraper with pagination"